{"$schema":"https://json-schema.org/draft/2020-12/schema","$id":"https://schemas.wastelandforge.dev/fnv/manifest/0.5.0/schema.json","title":"WastelandForge Manifest 0.5.0","type":"object","additionalProperties":false,"required":["schemaVersion","kind","id","name","version","game","registries"],"properties":{"schemaVersion":{"const":"0.5.0"},"kind":{"const":"manifest"},"id":{"type":"string","pattern":"^[a-z][a-z0-9]*(?:\\.[a-z][a-z0-9]*)+$"},"name":{"type":"string","minLength":1},"version":{"type":"string","minLength":1},"game":{"const":"falloutnv"},"metadata":{"type":"object"},"registries":{"type":"object","additionalProperties":false,"required":["dependencies","capabilities"],"properties":{"dependencies":{"$ref":"#/$defs/path"},"capabilities":{"$ref":"#/$defs/path"},"assets":{"$ref":"#/$defs/path"},"quests":{"$ref":"#/$defs/path"},"dialogue":{"$ref":"#/$defs/path"},"mcm":{"$ref":"#/$defs/path"},"jipScripts":{"$ref":"#/$defs/path"},"xeditAudit":{"$ref":"#/$defs/path"},"pluginArtifacts":{"$ref":"#/$defs/path"},"fomod":{"$ref":"#/$defs/path"},"geckAuthoringIntent":{"$ref":"#/$defs/path"}}},"outputs":{"type":"object"}},"$defs":{"path":{"type":"string","minLength":1,"not":{"pattern":"^(?:[a-zA-Z]:|/|\\\\)"}}}}

