{
  "schemaVersion": "0.5.0",
  "kind": "manifest",
  "id": "io.github.theboyyss.deadair",
  "name": "Dead Air",
  "version": "0.1.0",
  "game": "falloutnv",
  "metadata": {
    "summary": "A mystery quest mod centered on a lethal midnight broadcast originating from Lone Wolf Radio.",
    "contentPolicy": "Vanilla Fallout: New Vegas assets and records only."
  },
  "registries": {
    "dependencies": "src/registries/dependencies/",
    "capabilities": "src/registries/capabilities/",
    "quests": "src/registries/quests/",
    "dialogue": "src/registries/dialogue/"
  }
}
